{
 "id": "faces",
 "kind": "faces",
 "name": "Face",
 "description": "Face presets: scale factors on the neutral head's features (tools/blender/anatomy.py, add_head). 1.0 is neutral. brow: brow ridge; jaw: jaw width; cheek: cheekbones; nose: nose size; bridge: nose bridge width and hump; chin: chin size; lips: fullness; hollow: cheek hollows under the cheekbones; eyes: eye size.",
 "options": [
  {"id": "neutral", "name": "Steady", "params": {}},
  {"id": "stern", "name": "Stern", "params": {"brow": 1.35, "jaw": 1.12, "chin": 1.15, "lips": 0.85, "eyes": 0.92}},
  {"id": "gaunt", "name": "Gaunt", "params": {"cheek": 1.2, "jaw": 0.92, "hollow": 0.7, "nose": 1.05, "lips": 0.85}},
  {"id": "broad", "name": "Broad", "params": {"jaw": 1.18, "nose": 1.18, "bridge": 1.3, "lips": 1.2, "cheek": 1.1}},
  {"id": "sharp", "name": "Sharp", "params": {"nose": 1.1, "bridge": 0.8, "chin": 1.25, "jaw": 0.92, "cheek": 1.15, "eyes": 1.05}},
  {"id": "weathered", "name": "Weathered", "params": {"brow": 1.25, "nose": 1.25, "bridge": 1.2, "hollow": 0.6, "chin": 1.1, "eyes": 0.9}}
 ]
}
